number,value,datetime_start,datetime_complete,duration,params_activation,params_lbfgs_memory,params_lbfgs_tol,params_lr_adamw,params_n_layers,params_units_layer_0,params_units_layer_1,params_units_layer_2,params_units_layer_3,params_units_layer_4,params_weight_decay_adamw,user_attrs_final_bc,user_attrs_final_data,user_attrs_final_ic,user_attrs_final_loss,user_attrs_final_pde,user_attrs_lbfgs_loss_evaluations,user_attrs_lbfgs_n_iter,user_attrs_lbfgs_nfev_grad,user_attrs_lbfgs_nfev_plain,user_attrs_lbfgs_status,user_attrs_training_time,state
0,6.250085282820813e-05,2026-08-01 05:46:53.379092,2026-08-01 05:50:37.234595,0 days 00:03:43.855503,tanh,16,1.2087541473056933e-10,0.005399484409787433,4,90,47,47,37.0,,2.5378155082656606e-05,1.7056057946086985e-06,3.801014647581151e-05,4.1513965174030934e-07,6.250085282820813e-05,3.081635409985579e-05,24,0,1,22,line search failed to satisfy strong Wolfe on iteration 0 (consider float64),222.54966200399213,COMPLETE
1,0.0002811589595845795,2026-08-01 05:50:37.237929,2026-08-01 05:54:54.024656,0 days 00:04:16.786727,tanh,7,1.4742753159914648e-09,0.0003823475224675188,5,49,49,61,82.0,73.0,2.8016351587162606e-05,1.0307314159416307e-05,0.00010600844738306849,2.0867793487072786e-06,0.0002811589595845795,0.00015575037160889095,18,0,1,16,line search failed to satisfy strong Wolfe on iteration 0 (consider float64),256.4028373270121,COMPLETE
2,0.0001520922826872752,2026-08-01 05:54:54.050051,2026-08-01 06:04:46.439371,0 days 00:09:52.389320,swish,6,6.245139574743071e-07,0.0016409286730647919,4,51,81,89,36.0,,4.809461967501569e-07,6.42002466861183e-06,7.76121831078995e-05,3.597988585449616e-06,0.0001520922826872752,4.520618193577012e-05,72,3,4,67,line search failed to satisfy strong Wolfe on iteration 3 (consider float64),591.8649328949978,COMPLETE
3,0.005243750506321618,2026-08-01 06:04:46.449139,2026-08-01 06:09:31.872060,0 days 00:04:45.422921,tanh,9,4.467752817973904e-08,0.00011715937392307068,5,41,98,74,43.0,80.0,0.0004337920697490938,0.0003980303102290558,0.0007499064706054495,0.0001135804539751382,0.005243750506321618,0.0017428411801222315,96,9,10,85,line search failed to satisfy strong Wolfe on iteration 9 (consider float64),285.0032959309756,COMPLETE
4,0.00039924152805558786,2026-08-01 06:09:31.886295,2026-08-01 06:16:53.633864,0 days 00:07:21.747569,swish,14,4.869640941520896e-07,0.007568292060167618,3,49,126,107,,,0.0003795853142670637,1.5276728938225228e-05,0.00023006138400037877,7.487383588304126e-06,0.00039924152805558786,0.0001329533554812311,33,1,2,30,line search failed to satisfy strong Wolfe on iteration 1 (consider float64),441.34038736502407,COMPLETE
5,7.01298457577119e-05,2026-08-01 06:16:53.638920,2026-08-01 06:19:54.104011,0 days 00:03:00.465091,tanh,9,1.4817820606039055e-08,0.004544383960336014,3,63,69,58,,,2.6730883107816674e-06,1.1396806593010274e-06,4.023077672750737e-05,7.813943897432507e-07,7.01298457577119e-05,3.6502110200020574e-05,22,0,1,20,line search failed to satisfy strong Wolfe on iteration 0 (consider float64),180.0960001500207,COMPLETE
6,0.0027282596829250596,2026-08-01 06:19:54.136123,2026-08-01 06:23:02.579355,0 days 00:03:08.443232,tanh,16,8.241925264876447e-08,0.00010257563974185662,3,127,106,51,,,0.00018274508859815998,0.00025524134769830663,0.0002089438956241996,5.585435223487254e-05,0.0027282596829250596,0.0007890374742727014,34,0,1,32,line search failed to satisfy strong Wolfe on iteration 0 (consider float64),188.05204085301375,COMPLETE
7,0.001096012181652724,2026-08-01 06:23:02.593520,2026-08-01 06:35:01.478984,0 days 00:11:58.885464,swish,16,3.5500125258511614e-08,0.0004187594718900631,5,43,115,92,64.0,38.0,1.998634077852888e-06,3.0535683355861045e-05,0.0003149434274859523,4.4309968888062864e-05,0.001096012181652724,0.000342762362249814,30,0,1,28,line search failed to satisfy strong Wolfe on iteration 0 (consider float64),718.4727621609927,COMPLETE
8,0.00011535458167931102,2026-08-01 06:35:01.511870,2026-08-01 06:40:11.806878,0 days 00:05:10.295008,tanh,5,2.701255772543902e-10,0.0011103647313054626,5,101,105,86,106.0,79.0,5.130551760589833e-06,5.5381969250059745e-06,4.3606987611298856e-05,1.0298159510670374e-06,0.00011535458167931102,5.556194373796134e-05,44,2,3,40,line search failed to satisfy strong Wolfe on iteration 2 (consider float64),309.8663791330182,COMPLETE
9,0.00048355831661045035,2026-08-01 06:40:11.823099,2026-08-01 06:43:13.658333,0 days 00:03:01.835234,tanh,8,2.0319809838424988e-10,0.000661859559718348,3,81,120,56,,,0.00010524574681335637,7.971074353973806e-06,0.00029750566443192706,8.871883247726723e-06,0.00048355831661045035,0.00020623128014735063,33,0,1,31,line search failed to satisfy strong Wolfe on iteration 0 (consider float64),181.43804722401546,COMPLETE
10,5.588145813197901e-05,2026-08-01 06:43:13.692473,2026-08-01 06:53:06.887052,0 days 00:09:53.194579,swish,20,3.299263281612618e-09,0.0029255425810910765,4,126,33,34,120.0,,1.271124000730177e-07,4.794083683422174e-07,6.413492432146155e-05,5.763226436986988e-07,5.588145813197901e-05,1.565372769255016e-05,43,2,3,39,line search failed to satisfy strong Wolfe on iteration 2 (consider float64),592.6871500870038,COMPLETE
11,4.663335578555991e-05,2026-08-01 06:53:06.893299,2026-08-01 07:02:49.216642,0 days 00:09:42.323343,swish,20,1.7238692350672344e-09,0.003125447786535776,4,125,34,33,122.0,,1.0857502285134645e-07,1.8272749413214686e-06,4.695357333167773e-05,3.755190335892759e-07,4.663335578555991e-05,1.0265004077220938e-05,20,0,1,18,line search failed to satisfy strong Wolfe on iteration 0 (consider float64),581.838178178994,COMPLETE
12,6.232449373365771e-05,2026-08-01 07:02:49.249725,2026-08-01 07:12:30.421829,0 days 00:09:41.172104,swish,20,2.2069868905482694e-09,0.002489349802809645,4,128,34,33,128.0,,1.0952593635152478e-07,9.91565306017274e-07,4.4896504049674766e-05,1.0429295743576496e-06,6.232449373365771e-05,2.4489119435157465e-05,25,0,1,23,line search failed to satisfy strong Wolfe on iteration 0 (consider float64),580.7300868820166,COMPLETE
13,5.9602372341867905e-05,2026-08-01 07:12:30.431435,2026-08-01 07:22:31.065643,0 days 00:10:00.634208,swish,20,2.9601646865227025e-09,0.002881838632933024,4,111,33,34,128.0,,1.0641537409035755e-07,1.00553700719587e-06,5.4403562219379776e-05,7.116803170182836e-07,5.9602372341867905e-05,2.025610302601583e-05,62,3,4,57,line search failed to satisfy strong Wolfe on iteration 3 (consider float64),600.2383095069963,COMPLETE
14,8.914628977506125e-05,2026-08-01 07:22:31.101224,2026-08-01 07:32:38.270872,0 days 00:10:07.169648,swish,18,7.34086745651378e-09,0.009804595459120161,4,113,52,39,105.0,,4.5659610225130355e-07,1.9343713363058914e-06,9.251396410957241e-05,1.1987693698932388e-06,8.914628977506125e-05,2.1229757339813203e-05,67,5,6,60,line search failed to satisfy strong Wolfe on iteration 5 (consider float64),606.7361488770111,COMPLETE
15,6.356222798211734e-05,2026-08-01 07:32:38.279466,2026-08-01 07:42:27.992075,0 days 00:09:49.712609,swish,18,7.087963161648779e-10,0.0034275562635153974,4,113,64,44,110.0,,4.215667530736641e-07,1.2033889434597839e-06,4.83284936482097e-05,1.3564312122638937e-06,6.356222798211734e-05,1.9816724318074643e-05,40,3,4,35,line search failed to satisfy strong Wolfe on iteration 3 (consider float64),589.2804919490009,COMPLETE
16,0.00012466864708995815,2026-08-01 07:42:27.998274,2026-08-01 07:52:25.404715,0 days 00:09:57.406441,swish,13,6.6349405244116976e-09,0.0015793953371959853,4,119,41,32,92.0,,2.791653870620095e-07,4.603001747249882e-06,7.251561305851727e-05,2.6062597822840584e-06,0.00012466864708995815,3.933323400160953e-05,55,3,4,50,line search failed to satisfy strong Wolfe on iteration 3 (consider float64),596.9958717130066,COMPLETE
17,6.57755090475669e-05,2026-08-01 07:52:25.440634,2026-08-01 08:02:35.369681,0 days 00:10:09.929047,swish,18,7.429708749371189e-10,0.001180565082206403,4,102,59,68,119.0,,1.4849005837732323e-06,2.6322348414542617e-06,6.473650947388609e-05,1.0431075686809664e-06,6.57755090475669e-05,9.815004416542885e-06,87,11,12,74,line search failed to satisfy strong Wolfe on iteration 11 (consider float64),609.5077844210027,COMPLETE
18,0.0001380620836352316,2026-08-01 08:02:35.406275,2026-08-01 08:10:03.915641,0 days 00:07:28.509366,swish,20,4.767888795794937e-10,0.005165659195751525,3,98,33,128,,,1.74057977231196e-07,2.240229796385967e-06,0.00010824775103652202,2.6164581417605313e-06,0.0001380620836352316,4.657247771743545e-05,38,3,4,33,line search failed to satisfy strong Wolfe on iteration 3 (consider float64),448.094561720005,COMPLETE
19,6.410676426820012e-05,2026-08-01 08:10:03.953401,2026-08-01 08:22:11.108551,0 days 00:12:07.155150,swish,12,1.4619449559608947e-07,0.0023482397096247745,5,78,82,45,91.0,125.0,7.059000338561136e-07,8.474155683326981e-07,4.65833483947984e-05,1.0188496312899506e-06,6.410676426820012e-05,2.638951591623792e-05,28,0,1,26,line search failed to satisfy strong Wolfe on iteration 0 (consider float64),726.7176824760099,COMPLETE
20,0.00022130775027123572,2026-08-01 08:22:11.146037,2026-08-01 08:32:18.692061,0 days 00:10:07.546024,swish,18,5.331377015195855e-09,0.0008219296930618504,4,121,40,69,113.0,,7.572849695261556e-06,1.7918932649364764e-05,5.568060208205078e-05,4.382953188095715e-06,0.00022130775027123572,6.0043254102429366e-05,82,2,3,78,line search failed to satisfy strong Wolfe on iteration 2 (consider float64),607.1237031689961,COMPLETE
21,0.00011334436050933257,2026-08-01 08:32:18.730897,2026-08-01 08:41:56.404988,0 days 00:09:37.674091,swish,20,2.333001187396026e-09,0.002512863329499879,4,109,33,38,128.0,,1.3030133773607163e-07,5.479118196025935e-06,6.337658999062475e-05,1.8025093678315603e-06,0.00011334436050933257,3.623538085557491e-05,19,0,1,17,line search failed to satisfy strong Wolfe on iteration 0 (consider float64),577.2544828929822,COMPLETE
22,4.983393085672709e-05,2026-08-01 08:41:56.441266,2026-08-01 08:51:50.513011,0 days 00:09:54.071745,swish,19,3.518670174133374e-09,0.0030394743117802448,4,119,42,32,119.0,,1.0101159959278246e-07,1.4805313463525352e-06,5.1546028398235854e-05,5.06352906883235e-07,4.983393085672709e-05,1.1594730857014134e-05,44,0,1,42,line search failed to satisfy strong Wolfe on iteration 0 (consider float64),593.6527130150062,COMPLETE
23,4.5740635899114004e-05,2026-08-01 08:51:50.548449,2026-08-01 09:01:29.294272,0 days 00:09:38.745823,swish,19,1.703704861986987e-08,0.00420320565662274,4,122,54,42,119.0,,1.0107417221169982e-06,7.312721037534655e-07,4.704206265250272e-05,3.983016721413451e-07,4.5740635899114004e-05,1.4580227332681867e-05,16,0,1,14,line search failed to satisfy strong Wolfe on iteration 0 (consider float64),578.2548408670118,COMPLETE
24,8.365795086897346e-05,2026-08-01 09:01:29.330534,2026-08-01 09:11:29.547456,0 days 00:10:00.216922,swish,17,1.676097659043768e-08,0.006516644765486707,4,119,57,51,100.0,,9.988226493903068e-07,4.905060574899544e-06,5.651638656402485e-05,1.1645995799504515e-06,8.365795086897346e-05,1.9228458912958798e-05,52,2,3,48,line search failed to satisfy strong Wolfe on iteration 2 (consider float64),599.7602253319928,COMPLETE
25,5.897707615390501e-05,2026-08-01 09:11:29.553554,2026-08-01 09:21:05.601154,0 days 00:09:36.047600,swish,19,1.4823845806702864e-08,0.003614645113106631,4,104,71,42,117.0,,3.2190995702381693e-07,1.4059511987948413e-06,5.320374676912368e-05,6.72787692096074e-07,5.897707615390501e-05,1.8617569854408217e-05,22,0,1,20,line search failed to satisfy strong Wolfe on iteration 0 (consider float64),575.6404452089919,COMPLETE
26,7.710394139851806e-05,2026-08-01 09:21:05.634988,2026-08-01 09:33:08.371251,0 days 00:12:02.736263,swish,15,1.1618367518180034e-09,0.0019364729654422791,5,92,44,52,95.0,120.0,2.5590668020860594e-07,2.6053977197732957e-06,4.675187700695601e-05,1.4203009540781632e-06,7.710394139851806e-05,2.6498004755391945e-05,28,0,1,26,line search failed to satisfy strong Wolfe on iteration 0 (consider float64),722.3047029149893,COMPLETE
27,0.00014317080307974233,2026-08-01 09:33:08.407880,2026-08-01 09:40:43.723454,0 days 00:07:35.315574,swish,17,2.6828992176655516e-08,0.004264511510793844,3,121,55,43,,,4.5980074604082676e-06,8.962582539496892e-06,8.541542955336835e-05,2.3941197088024007e-06,0.00014317080307974233,3.170897851754968e-05,47,4,5,41,line search failed to satisfy strong Wolfe on iteration 4 (consider float64),454.9037928399921,COMPLETE
28,4.77273792285697e-05,2026-08-01 09:40:43.761529,2026-08-01 09:50:28.297766,0 days 00:09:44.536237,swish,19,1.6341423042057446e-07,0.0069095300050743035,4,116,42,64,81.0,,1.1424948923054263e-06,1.1947999658426785e-06,4.3778763748175055e-05,6.340684054525935e-07,4.77273792285697e-05,1.3523313470742848e-05,18,0,1,16,line search failed to satisfy strong Wolfe on iteration 0 (consider float64),584.1076309380005,COMPLETE
29,6.431149127737531e-05,2026-08-01 09:50:28.333941,2026-08-01 10:00:56.192405,0 days 00:10:27.858464,swish,17,2.3827714264690524e-07,0.009533054443900233,4,92,48,80,73.0,,1.3280009676511001e-05,1.2678799919371769e-06,4.1001269726421864e-05,1.248970579014252e-06,6.431149127737531e-05,2.4981750664335976e-05,116,5,6,109,line search failed to satisfy strong Wolfe on iteration 5 (consider float64),627.4038590310083,COMPLETE
