number,value,datetime_start,datetime_complete,duration,params_activation,params_lr_phase1,params_lr_phase2,params_n_layers,params_units_layer_0,params_units_layer_1,params_units_layer_2,params_units_layer_3,params_units_layer_4,params_weight_decay_phase1,params_weight_decay_phase2,user_attrs_epochs_phase1,user_attrs_epochs_phase2,user_attrs_final_bc,user_attrs_final_data,user_attrs_final_ic,user_attrs_final_loss,user_attrs_final_pde,user_attrs_training_time,system_attrs_completed_rung_0,system_attrs_completed_rung_1,system_attrs_completed_rung_2,system_attrs_completed_rung_3,system_attrs_completed_rung_4,system_attrs_completed_rung_5,system_attrs_completed_rung_6,state
0,0.13841283321380615,2026-07-31 13:32:53.645568,2026-07-31 13:37:26.715970,0 days 00:04:33.070402,tanh,0.005399484409787433,0.00015930522616241006,4,90,47,47,37.0,,0.000133112160807369,1.152798712823239e-07,1000.0,500.0,5.623140532406978e-05,0.23136961460113525,0.0019551876466721296,0.13841283321380615,0.0028949857223778963,271.99141332300496,0.5273177623748779,0.5273177623748779,0.5273177623748779,0.5273177623748779,0.5273177623748779,0.2763727605342865,0.31300073862075806,COMPLETE
1,0.7226809859275818,2026-07-31 13:37:26.717050,2026-07-31 13:38:07.375022,0 days 00:00:40.657972,tanh,0.0003823475224675188,0.00016738085788752134,5,49,49,61,82.0,73.0,2.62108787826544e-06,7.52374288453486e-07,,,,,,,,,0.7226809859275818,,,,,,,PRUNED
2,0.698280394077301,2026-07-31 13:38:07.375730,2026-07-31 13:39:31.158633,0 days 00:01:23.782903,swish,0.0016409286730647919,2.1930485556643678e-05,4,51,81,89,36.0,,1.5673095467235414e-06,7.025166339242167e-05,,,,,,,,,0.698280394077301,,,,,,,PRUNED
3,0.4212990999221802,2026-07-31 13:39:31.159208,2026-07-31 13:45:02.518637,0 days 00:05:31.359429,tanh,0.00011715937392307068,0.000658628931758311,5,41,98,74,43.0,80.0,5.975027999960295e-06,9.717775305059638e-06,1000.0,500.0,0.0003543919592630118,0.47276654839515686,0.017691876739263535,0.4212990999221802,0.006225111894309521,331.18005314400943,0.8879619240760803,0.8879619240760803,0.8879619240760803,0.8879619240760803,0.7247467041015625,0.6191222667694092,,COMPLETE
4,1.1884920597076416,2026-07-31 13:45:02.519436,2026-07-31 13:46:03.733810,0 days 00:01:01.214374,swish,0.007568292060167618,0.0006161049539380963,3,49,126,107,,,6.218704727769077e-05,5.829384542994748e-05,,,,,,,,,1.1884920597076416,,,,,,,PRUNED
5,0.21297290921211243,2026-07-31 13:46:03.734385,2026-07-31 13:49:54.211647,0 days 00:03:50.477262,tanh,0.004544383960336014,5.170191786366994e-05,3,63,69,58,,,6.963114377829292e-06,4.247058562261874e-06,1000.0,500.0,7.82967108534649e-05,0.35704857110977173,0.0027807464357465506,0.21297290921211243,0.006249669007956982,230.30856334599957,0.6655393838882446,0.6655393838882446,0.6655393838882446,0.6655393838882446,0.3797043263912201,0.269643634557724,,COMPLETE
6,0.486947238445282,2026-07-31 13:49:54.212323,2026-07-31 13:53:37.879227,0 days 00:03:43.666904,tanh,0.00010257563974185662,0.0004274869455295214,3,127,106,51,,,0.00013199942261535007,1.5382308040279007e-05,1000.0,500.0,0.000832460995297879,0.4371943771839142,0.026109743863344193,0.486947238445282,0.0030903073493391275,223.42870192400005,1.0594180822372437,1.0594180822372437,1.0594180822372437,0.8275519609451294,0.6900266408920288,,,COMPLETE
7,0.7173529863357544,2026-07-31 13:53:37.879928,2026-07-31 13:55:19.301089,0 days 00:01:41.421161,swish,0.0004187594718900631,4.4706085467784903e-05,5,43,115,92,64.0,38.0,0.0001544608907504709,8.178476574339539e-06,,,,,,,,,0.7173529863357544,,,,,,,PRUNED
8,0.6068154573440552,2026-07-31 13:55:19.301757,2026-07-31 13:56:04.042997,0 days 00:00:44.741240,tanh,0.0011103647313054626,7.162786999897333e-05,5,101,105,86,106.0,79.0,1.1919481947918734e-06,2.1070472806578214e-07,,,,,,,,,0.6068154573440552,,,,,,,PRUNED
9,0.7093684673309326,2026-07-31 13:56:04.043572,2026-07-31 13:56:34.899508,0 days 00:00:30.855936,tanh,0.000661859559718348,0.0003244160088734161,3,81,120,56,,,4.857295179217169e-06,1.7019223026554018e-07,,,,,,,,,0.7093684673309326,,,,,,,PRUNED
10,0.39707016944885254,2026-07-31 13:56:34.900017,2026-07-31 13:59:29.480277,0 days 00:02:54.580260,swish,0.0029255425810910765,1.1274413513483428e-05,4,126,33,34,120.0,,0.0007190910632155918,1.376615737978465e-06,,,,,,,,,0.5186966061592102,0.5186966061592102,0.5186966061592102,0.5186966061592102,0.39707016944885254,,,PRUNED
11,0.703864574432373,2026-07-31 13:59:29.480840,2026-07-31 14:00:04.923455,0 days 00:00:35.442615,tanh,0.009596878076190017,0.00011774450741898605,4,76,63,36,86.0,,2.502152530291144e-05,1.742158416313674e-06,,,,,,,,,0.703864574432373,,,,,,,PRUNED
12,0.5995460152626038,2026-07-31 14:00:04.923999,2026-07-31 14:00:40.801029,0 days 00:00:35.877030,tanh,0.003961670045955172,4.848401495672273e-05,4,73,66,67,63.0,,2.335989777187903e-05,1.0219286592444086e-07,,,,,,,,,0.5995460152626038,,,,,,,PRUNED
13,0.6405584812164307,2026-07-31 14:00:40.801557,2026-07-31 14:01:12.803823,0 days 00:00:32.002266,tanh,0.004325843743477757,0.00014372038860437105,3,95,41,46,,,0.0007870708682262809,4.0853408470062395e-07,,,,,,,,,0.6405584812164307,,,,,,,PRUNED
14,0.7031201720237732,2026-07-31 14:01:12.804350,2026-07-31 14:01:49.874230,0 days 00:00:37.069880,tanh,0.002134204061375389,0.00024548978588103087,4,64,56,119,100.0,,1.3841767450456846e-05,2.7113558808034692e-06,,,,,,,,,0.7031201720237732,,,,,,,PRUNED
15,0.6688875555992126,2026-07-31 14:01:49.874821,2026-07-31 14:02:18.344341,0 days 00:00:28.469520,tanh,0.005328850197442459,2.7239559803825495e-05,3,95,82,74,,,0.00028148122288890117,4.654198520602959e-06,,,,,,,,,0.6688875555992126,,,,,,,PRUNED
16,0.34175360202789307,2026-07-31 14:02:18.344876,2026-07-31 14:03:35.478935,0 days 00:01:17.134059,tanh,0.005833369208814366,7.803511669278675e-05,4,108,77,45,124.0,,6.534932975325258e-05,1.7879088211630125e-05,,,,,,,,,0.5072805285453796,0.5072805285453796,0.5072805285453796,0.5072805285453796,0.5072805285453796,0.34175360202789307,,PRUNED
17,0.6804301738739014,2026-07-31 14:03:35.479631,2026-07-31 14:04:05.181774,0 days 00:00:29.702143,tanh,0.0027518982251189556,2.4300699661680617e-05,3,64,69,63,,,1.0516986507532853e-05,5.556040081035785e-07,,,,,,,,,0.6804301738739014,,,,,,,PRUNED
18,0.6891146898269653,2026-07-31 14:04:05.182325,2026-07-31 14:05:33.562651,0 days 00:01:28.380326,swish,0.0013173947450456967,0.0009606261224252248,4,88,48,42,55.0,,4.249973885664439e-05,3.164583691589958e-05,,,,,,,,,0.6891146898269653,,,,,,,PRUNED
19,0.6596686840057373,2026-07-31 14:05:33.563215,2026-07-31 14:06:05.343632,0 days 00:00:31.780417,tanh,0.009827674611457336,7.508063244870837e-05,3,113,90,69,,,0.00033975249718235965,4.5548971093535e-06,,,,,,,,,0.6596686840057373,,,,,,,PRUNED
20,0.6150625944137573,2026-07-31 14:06:05.344168,2026-07-31 14:06:44.092977,0 days 00:00:38.748809,tanh,0.003227256529161389,1.0069141253237132e-05,4,63,32,57,77.0,,5.074966820903748e-06,1.0634793259454475e-06,,,,,,,,,0.6150625944137573,0.6150625944137573,,,,,,PRUNED
21,0.8740116357803345,2026-07-31 14:06:44.093466,2026-07-31 14:07:30.852455,0 days 00:00:46.758989,tanh,0.00021830338575819802,0.0005984416905658185,5,37,94,78,38.0,125.0,5.80627323347665e-06,9.339167381850725e-06,,,,,,,,,0.8740116357803345,,,,,,,PRUNED
22,1.101963996887207,2026-07-31 14:07:30.853006,2026-07-31 14:08:12.167118,0 days 00:00:41.314112,tanh,0.00010651193715901657,0.0002588702203010174,5,36,58,80,48.0,127.0,3.1007423093170587e-06,2.6443778103385005e-05,,,,,,,,,1.101963996887207,,,,,,,PRUNED
23,1.036738395690918,2026-07-31 14:08:12.167655,2026-07-31 14:08:55.709475,0 days 00:00:43.541820,tanh,0.0001721450414002607,0.0009036751662605277,5,54,96,51,34.0,84.0,9.654519054977196e-06,3.4819154719382224e-06,,,,,,,,,1.036738395690918,,,,,,,PRUNED
24,0.8459375500679016,2026-07-31 14:08:55.710057,2026-07-31 14:09:41.353442,0 days 00:00:45.643385,tanh,0.0006490061647194816,0.00019287511239386845,5,33,72,71,50.0,32.0,1.7812860998748306e-05,8.588699864143072e-06,,,,,,,,,0.8459375500679016,,,,,,,PRUNED
25,0.6975489854812622,2026-07-31 14:09:41.353976,2026-07-31 14:10:16.430464,0 days 00:00:35.076488,tanh,0.001000875312235328,0.00011126496409601119,4,59,43,98,45.0,,3.833382755221475e-05,2.2799860482735908e-06,,,,,,,,,0.6975489854812622,,,,,,,PRUNED
26,0.7625157833099365,2026-07-31 14:10:16.430996,2026-07-31 14:11:41.828593,0 days 00:01:25.397597,swish,0.00027904495545105757,4.250695215446151e-05,4,82,88,52,61.0,,7.841997030033946e-06,3.0610489983254186e-07,,,,,,,,,0.7625157833099365,,,,,,,PRUNED
27,0.6692919135093689,2026-07-31 14:11:41.829132,2026-07-31 14:12:11.439260,0 days 00:00:29.610128,tanh,0.001980448859654978,0.00046108708807882337,3,68,100,41,,,2.243294903889367e-06,4.3170738485128614e-05,,,,,,,,,0.6692919135093689,,,,,,,PRUNED
28,0.543765664100647,2026-07-31 14:12:11.439817,2026-07-31 14:12:57.820022,0 days 00:00:46.380205,tanh,0.005519769069709485,1.5090290742829625e-05,5,45,56,64,71.0,102.0,0.00011295381654677345,8.861054319827119e-05,,,,,,,,,0.543765664100647,0.543765664100647,,,,,,PRUNED
29,0.6888179779052734,2026-07-31 14:12:57.820551,2026-07-31 14:13:45.197700,0 days 00:00:47.377149,tanh,0.0006720940464224679,0.00018739712829689872,5,56,48,59,32.0,55.0,3.0838455841251294e-06,9.428386223990838e-07,,,,,,,,,0.6888179779052734,,,,,,,PRUNED
